"query","search interest","increase percent"
"what is the best way to determine if a cpu fan is spinning properly?",2,"Breakout"
"an employee reports that the antivirus software cannot obtain updates. the support technician notices that the license for the software has expired. the technician adds a new license to the software and completes the update service. what should the technician do next?",1,"Breakout"
"what is the next step after a possible solution is implemented during a troubleshooting process?",1,"Breakout"
"a helpdesk technician takes a call, good morning, this is the helpdesk. my name is greg. how may i help you today? the frantic caller states, my computer will not turn on and i have a presentation in 15 minutes. the technician responds, now calm down and let us see what we can do. the technician then proceeds to lead the caller through the process of checking power cables and power lights. which troubleshooting step is being used at this point?",1,"Breakout"
"an employee reports that the output of a workstation display is distorted. the technician checks the manufacturer website and downloads the latest version of the video driver. after the video driver is installed, what should the technician do next?",1,"Breakout"
"a technician is performing hardware maintenance of pcs at a construction site. what task should the technician perform as part of a preventive maintenance plan?",1,"Breakout"
"what is a primary benefit of preventive maintenance on a pc?",1,"Breakout"
"power bi",8,"300%"
"the",100,"110%"
"pgn solution",2,"50%"
"pt power pack industrial solution",27,"40%"
"power pack industrial solution",38,"30%"
"power pack",40,"10%"
"cosrx bha blackhead power liquid",2,"-30%"