"query","search interest","increase percent"
"manufacturing indonesia 2025",4,"Breakout"
"manufacturing indonesia 2024",3,"Breakout"
"manufacturing indonesia 2023",2,"Breakout"
"pt daihatsu drivetrain manufacturing indonesia",1,"Breakout"
"pt sailun manufacturing indonesia",1,"Breakout"
"pt evo manufacturing indonesia",1,"Breakout"
"pt champion mattress indonesia manufacturing",0,"Breakout"
"pt toyoparts manufacturing indonesia",0,"Breakout"
"pt bmt oppo manufacturing indonesia",0,"Breakout"
"pt chateraise indonesia manufacturing",0,"Breakout"
"manufacturing indonesia 2022",2,"Breakout"
"daihatsu drivetrain manufacturing indonesia",1,"3,650%"
"glico manufacturing indonesia",2,"1,850%"
"pt glico manufacturing indonesia",1,"1,400%"
"gaji pt hyundai motor manufacturing indonesia",1,"500%"
"pt wavin manufacturing indonesia",0,"350%"
"pt narumi manufacturing indonesia",1,"250%"
"pt arai indonesia manufacturing",1,"200%"
"pt yutaka manufacturing indonesia produksi apa",0,"200%"
"narumi manufacturing indonesia",1,"200%"
"linkedin",1,"170%"
"pt perfect companion indonesia manufacturing",0,"150%"
"hyundai",11,"140%"
"pt kyb hydraulics manufacturing indonesia",1,"140%"
"denso",8,"130%"
"denso manufacturing indonesia",7,"130%"
"loker pt hyundai motor manufacturing indonesia",1,"120%"
"hyundai motor manufacturing indonesia",9,"120%"
"pt hyundai motor manufacturing indonesia",7,"110%"
"pt. denso manufacturing indonesia",1,"80%"
"pt denso",5,"80%"
"pt denso indonesia",5,"80%"
"pt denso manufacturing indonesia",5,"80%"
"pt sanwa manufacturing indonesia",0,"80%"
"kohler manufacturing indonesia",1,"60%"
"manufacturing adalah",5,"50%"
"daikin manufacturing indonesia",2,"50%"
"pt grand dinamika manufacturing indonesia",0,"50%"
"tsubaki indonesia manufacturing",1,"50%"
"pt tsubaki indonesia manufacturing",1,"40%"
"panasonic manufacturing indonesia",6,"40%"
"pt kohler manufacturing indonesia",1,"40%"
"pt daikin manufacturing indonesia",1,"40%"
"pt fonterra brands manufacturing indonesia",0,"30%"
"pt.hyundai motor manufacturing indonesia",0,"30%"
"pt oppo manufacturing indonesia",2,"30%"
"pt nissin manufacturing indonesia",1,"20%"
"oppo manufacturing indonesia",2,"20%"
"pt topy palingda manufacturing indonesia",1,"20%"
"pt yamaha indonesia motor manufacturing",12,"20%"